{
  "schema": "sequon/record/1",
  "kind": "dna",
  "molecule_type": null,
  "topology": "linear",
  "name": "sequon-fixture-030",
  "description": null,
  "length": 153,
  "sequence": "ACGTACGTGGCCTTAAGGCCTTCGAAACGTACGTTAGCATCGATCGTACGATCGATCGTAGCTAGCTAGCATCGATCGTAGCTAGCTAGCATCGATCGTAGCTAGCTAGCGATCGATCGATCGTAGCTAGCTAGCATCGATCGTAGCTAGCTA",
  "digests": {
    "algorithm": "sequon-digest/1",
    "sequence": "sha256:a9d9ad4d2364e37ba5dd01f1871ed2a49f0f6a09d6853940a7ed3dfc637ab3bc",
    "canonical": "sha256:a9d9ad4d2364e37ba5dd01f1871ed2a49f0f6a09d6853940a7ed3dfc637ab3bc"
  },
  "features": [
    {
      "key": "primer_bind",
      "so_term": "SO:0005850",
      "name": "M13F",
      "location": {
        "operator": "span",
        "strand": 0,
        "segments": [
          {
            "start": 0,
            "end": 17,
            "start_partial": false,
            "end_partial": false
          }
        ]
      },
      "qualifiers": []
    },
    {
      "key": "primer_bind",
      "so_term": "SO:0005850",
      "name": "M13R",
      "location": {
        "operator": "span",
        "strand": 0,
        "segments": [
          {
            "start": 29,
            "end": 46,
            "start_partial": false,
            "end_partial": false
          }
        ]
      },
      "qualifiers": []
    }
  ],
  "provenance": {
    "producer": {
      "kind": "parser",
      "name": "sequon-io",
      "version": "0.1.0"
    },
    "source_format": "snapgene-dna",
    "source_digest": "sha256:5f062189fd007dff508b349a1341dce964addadb8a09bf51e1d9c2a292f780e3",
    "source_bytes": 1016,
    "export_version": 15
  },
  "extras": {
    "snapgene": {
      "dna_flags": 0,
      "notes": [
        {
          "attributes": [],
          "name": "UUID",
          "value": "00000000-0000-4000-8000-000000000001"
        },
        {
          "attributes": [],
          "name": "Type",
          "value": "Synthetic"
        },
        {
          "attributes": [],
          "name": "ConfirmedExperimentally",
          "value": "0"
        },
        {
          "attributes": [],
          "name": "CustomMapLabel",
          "value": "sequon-fixture-030"
        },
        {
          "attributes": [],
          "name": "UseCustomMapLabel",
          "value": "1"
        },
        {
          "attributes": [],
          "name": "Organism",
          "value": "synthetic construct"
        }
      ],
      "primer_settings": [
        {
          "name": "minContinuousMatchLen",
          "value": "10"
        },
        {
          "name": "allowMismatch",
          "value": "1"
        },
        {
          "name": "minMeltingTemperature",
          "value": "40"
        },
        {
          "name": "showAdditionalFivePrimeMatches",
          "value": "1"
        },
        {
          "name": "minimumFivePrimeAnnealing",
          "value": "15"
        }
      ],
      "primers": [
        {
          "attributes": [
            {
              "name": "recentID",
              "value": "0"
            },
            {
              "name": "name",
              "value": "M13F"
            },
            {
              "name": "sequence",
              "value": "GTAAAACGACGGCCAGT"
            },
            {
              "name": "tm",
              "value": "58.4"
            }
          ],
          "binding_sequence": null,
          "color": null,
          "feature_index": 0,
          "name": "M13F",
          "sequence": "GTAAAACGACGGCCAGT",
          "strand": 0,
          "tm": "58.4"
        },
        {
          "attributes": [
            {
              "name": "recentID",
              "value": "1"
            },
            {
              "name": "name",
              "value": "M13R"
            },
            {
              "name": "sequence",
              "value": "CAGGAAACAGCTATGAC"
            },
            {
              "name": "tm",
              "value": "57.1"
            }
          ],
          "binding_sequence": null,
          "color": null,
          "feature_index": 1,
          "name": "M13R",
          "sequence": "CAGGAAACAGCTATGAC",
          "strand": 0,
          "tm": "57.1"
        }
      ]
    }
  }
}
