{
  "schema": "sequon/record/1",
  "kind": "dna",
  "molecule_type": "other",
  "topology": "linear",
  "name": "SYN162",
  "description": "unknown molecule subtype.",
  "length": 120,
  "sequence": "ATGTTCCATCCGAGGAACCAAGTACAGAGGCTTAATCAAAACGCTGGGGACAGCAAAGTGATTTCATGTCACCGACAAATTAGAACTCCGAGGATCAAAAGTGATTTCATGAACATTTAA",
  "digests": {
    "algorithm": "sequon-digest/1",
    "sequence": "sha256:5993514390f2cdff65801f9325dfa707472d67d2c50b22b0aa5f2437ee25d65e",
    "canonical": "sha256:5993514390f2cdff65801f9325dfa707472d67d2c50b22b0aa5f2437ee25d65e"
  },
  "features": [
    {
      "key": "misc_feature",
      "so_term": "SO:0000110",
      "name": null,
      "location": {
        "operator": "span",
        "strand": 1,
        "segments": [
          {
            "start": 0,
            "end": 10,
            "start_partial": false,
            "end_partial": false
          }
        ]
      },
      "qualifiers": [
        {
          "key": "note",
          "value": "other subtype"
        }
      ]
    }
  ],
  "provenance": {
    "producer": {
      "kind": "parser",
      "name": "sequon-io",
      "version": "0.1.0"
    },
    "source_format": "genbank",
    "source_digest": "sha256:68a43d0726a025d66198ffd8b2bc0c4e74876a523906e0584e4df3e68f1e3d6b",
    "source_bytes": 391,
    "export_version": null
  },
  "extras": {
    "genbank": {
      "division": "SYN",
      "header": [
        {
          "key": "DEFINITION",
          "value": "unknown molecule subtype."
        }
      ]
    }
  }
}
