{
  "schema": "sequon/record/1",
  "kind": "dna",
  "molecule_type": "ds-DNA",
  "topology": "linear",
  "name": "SYN110",
  "description": "no features.",
  "length": 60,
  "sequence": "ATGTTCCATCCGAGGAACCAAGTACAGAGGCTTAATCAAAACGCTGGGGACAGCAAAGTG",
  "digests": {
    "algorithm": "sequon-digest/1",
    "sequence": "sha256:2f5036711a1eb300e38da10a600d554717682b566dd3824e3b7101262f644766",
    "canonical": "sha256:2f5036711a1eb300e38da10a600d554717682b566dd3824e3b7101262f644766"
  },
  "features": [],
  "provenance": {
    "producer": {
      "kind": "parser",
      "name": "sequon-io",
      "version": "0.1.0"
    },
    "source_format": "genbank",
    "source_digest": "sha256:225cfad53cce1d067525de4522d460e45df839cab74324eb5bcf57f66d5ab933",
    "source_bytes": 232,
    "export_version": null
  },
  "extras": {
    "genbank": {
      "header": [
        {
          "key": "DEFINITION",
          "value": "no features."
        }
      ]
    }
  }
}
