{
  "schema": "sequon/record/1",
  "kind": "dna",
  "molecule_type": "ds-DNA",
  "topology": "linear",
  "name": "SYN080A",
  "description": "first record.",
  "length": 60,
  "sequence": "ATGTTCCATCCGAGGAACCAAGTACAGAGGCTTAATCAAAACGCTGGGGACAGCAAAGTG",
  "digests": {
    "algorithm": "sequon-digest/1",
    "sequence": "sha256:2f5036711a1eb300e38da10a600d554717682b566dd3824e3b7101262f644766",
    "canonical": "sha256:2f5036711a1eb300e38da10a600d554717682b566dd3824e3b7101262f644766"
  },
  "features": [
    {
      "key": "CDS",
      "so_term": "SO:0000316",
      "name": "first",
      "location": {
        "operator": "span",
        "strand": 1,
        "segments": [
          {
            "start": 0,
            "end": 60,
            "start_partial": false,
            "end_partial": false
          }
        ]
      },
      "qualifiers": [
        {
          "key": "gene",
          "value": "first"
        }
      ]
    }
  ],
  "provenance": {
    "producer": {
      "kind": "parser",
      "name": "sequon-io",
      "version": "0.1.0"
    },
    "source_format": "genbank",
    "source_digest": "sha256:ae1ca210d39c2536d446b49112d9dab7b97acd170d192db04a53ac889b401f91",
    "source_bytes": 592,
    "export_version": null
  },
  "extras": {
    "genbank": {
      "division": "SYN",
      "header": [
        {
          "key": "DEFINITION",
          "value": "first record."
        }
      ]
    }
  }
}
