{
  "schema": "sequon/record/1",
  "kind": "dna",
  "molecule_type": "ds-DNA",
  "topology": "circular",
  "name": "SYN040",
  "description": "cross origin feature.",
  "length": 6000,
  "sequence": "ACCTCGCTGTTGGTAAGCCAGCACCAATTTGGACGTCCTTACGGACCGATGTTCAAAATAATGAAAGGGTTGTCCCTGATCGCAGTTAGCAGCTCGTTTAAAGTCGCATTCGCCCTACTATCGATTTAACGCTAACTGCAGTAACAATGGTCCGATGGAAGCGCAGCGTATAGTTACGATAAGACCGTGCAAAACCAGGCGATATCACCATACACTGGGTGTGTGGCTCACCGCAGGGAGAACGCCGCGCAACGGACCGATATGTACACCCGAGTTGACTCGTGGGGGAACCTAGTCTCTCTCTATACTACCACACAGGAGGTTGCTGAGGCGCGGATAATCAGTTGTAGGTCGGCCGTCGCGGTCCGGGCTTTTGCCTATCTTGACGCCTTGTTTATACATCTCTCGAGAATTTTTGTATCAAACTTTAATCGCGGTGCATGCGTTTACAACTGCGAAACTGGATCGGTATTCGCCATTCCCTGCTGCAACCCCAGTAAGTACCGAGATCTTATTTCCCGGCATCTCTATAATCCCAGAATTTGTAGACACAACCAGAAAACGTTAGGCGTACTGGCACCATTGACATGTGTTTTAGATTGACCCGTAACGATGTGTTTAGATTGCTGACCCAGTACTATTTTTTTGAACCCGTGCAGAGTCTCCACCTCTCGAGATTGCAATGATCTGGTGTCCTCCAAGTTCAAGATTGATAATCCAAGCTTGCTGTGTGTTGAGAGAGGCGGTAGTGAGTTGCCTAATAATTCTGGTTGCCTCGTCGCCCGTTCTTATACAATGATGCAAGTGCTCTCTGTCAGGGCGAGATCTTCTACTGAGTCCTGTCACGATGCGCGATGGCAGGAGAAGCGCGTTTTTTAAAACGATCGAAGATCGGCGCGAACAACAGGTATTCATCGACATAGTCTTTCCTTAAATTTTACTAATACTGAGCGCGGCTTCACACATCAGTCCTGAAGCAGATGTGGCGTGTCTACCCTGAGGGGTAAACCTGTTAGCCCTATAGAGCGGACTTGAATCTCTGAACGCCGCTTTCGGACGGACAACCGAACTCTCGAATAGCCTTCCCCGTTCTTCAATGAGGCTGTCGCGCTCTCTGGCCCCCGTGGACTGTATACTGAGCAGAATAAAGGTGACTCCCGTCGATCCTCACGTTAATTCCAGTACGTGGGGAGCTTAGGAGCAAAGCAGCCATGAAAAATCGCCGTGGAACTTTAATGCAATCTCTCAGGGCCTGATAGTTGTTAGACCAGTGGACCGTTCGACAACTCGATTCTGGTCCGGAGATCGCCAATGTCACGTAGATAGTAACTTGGTTTCCCGCCGTTATGACGCAAATCATTGAAGTACGTTGACTTGTGGTACGCTTCCGGGTAGCACTGAATAGGCGACGCCCTTGCCTACCACGATACCAGCCAAATGACAAATTTAATTTCCAGCTTTTCTCGGCATAGAGACATACCAGGATCAACTGGATGTAAGACTCCCGGCCGCTTACACCAGGCATCATCAGCTCTGAATCACATATGACCTACTTAGGCCTGGATGCTTCAAGCTTCCGTACGGGCGAAACGCACCTCAGCTGGGACAGTGCCAGTGCACAGGAATGGCTTGCGTCAATACCACTCTACACTTTTACTATTGATGCTCTATGTTGCAAAAGTTGAGTTGTGAGCACAACCAGGGTGGCGGCCATCCCCAACTTCTAAATGCCATTCCTCGCGTTGCTCACGAGGCTTCGATTTCTGAGATGCTTCAAGTGTCGTAGCAGCATATACGATGGACGGGAATGATACCGCCTGTTGGACAAACCTGCAGTTCAGGGAAGACTACACCTCGCTGTAGCACGCTCAAAAGACGAATCAAATTAGAGTCTAATACTTTGACGACATAGTTTTGCCACAGTAATGGCCACTATCAGCGCTCGCTATGGCGACCCACCGACTATACGCAGCTCCAGCATCCGTCTCCTCGAGGTCATTTCAAACATGGTAGGGCGAGCTCGAGTGTAAGGATTCGTGTATCGAGCTCGATTGTTGACAAATCGGGTGCTGTGCACGGTGTATGGTGTGATCGATTGTCGCATTTTCCTGATGATTGCATCGAATCGCAGAGCCCAATATTGCCGGTGTCATGATACGTGTCCTCACTGACAAGCAGGAACTACTCGGTGCGATTGGGGTCCTGCTAATCAGCCGATGCACGGTAACTAAATCCACACATAATCTGAACCGTTATAGCAAGTATGGCTCCTCCCTTGCAGTTTCGAGCTTACACACAAATAAGCCTAGCTTGAGGTGCATCGTGGATGGCCCACGGTCCGCTCCGAGAATGAGTATCGAGCCATTGGAGGTTGCTCTTTTGCCTCGAATTCAACTTGCGCCCTAGATTCTCATTATGTTCTAGTGTTGGCACCTTAAACGTTTTGTCGTATTCTCGCCGATGCACTGAATCCCTATGGCCCGTTACTGATTGACATGTCCCCGCTCCCTGCCTAATATGAGGATCGAAGTGGAGATTAGGAGGAGTTATAGTTCGCGTGGTATCACGACGCCATGGCAAGGGACACCTCCATGGAGACCCCTACTCTCGGCTGGTTTTTATGGTTAACTGTACGACCCAACTCTAGCATCCAAGTTCAACGCAAAACTTCTATATGTGTAGCACGTTGACCTTCTTGCGGCCCAAATGGCTGAGATCGCGCGGCCCTCTCCATGGGCACATGCCTGATATTGTGAGCATACCGTATGAGGAGTACCAGGCTTTTGACCAGTGAACCAGTGAACCGACACCACGTACTGAACCTACAATTTGTATATAATAGGGACCGACCGGGAGGCCACGACCGGTATTAGCGGTTTGACCCGGCTGTTAAGGCCTAAACGCACGTGCTGAAGACAGTCGCTGTCTTGGGTTCAATAGTCAACCGGGCCTTAACTGCTTTACCGTTGTCGGCTATAAAAGGGTATCTATGATATGCTCCGTTAAGCCACTCCTTGAGAGGAAACTTTGCACATTGACACTGAGCGTATCTTATTCCTAGAAGCGCGTACACACGGCAACGTGCGTCTGATTGCGACTACGGGCATCAGAACAGCAATGGACCATGTGCTCAATACACCATTCGTGTTAAGAGGAGCTCTGACATGGTTTATTGAGTTCGTATCGGATTTATCGCCAAGTTCAGTTTCCTCTGCGCAAGCCTTTGTACGTACTGTTGATCCCCATGTTACCCGGCAAGGTCTGTCCCAGTAACCAAATCGATTCGAGGCGAATCAGCGCACGCAGGACTTGATAAACTGACTCTTTAGCACTCAATGACGTATGGATCAAGCGCCAGGTCCTAGAACCCTTTATAAAGACTTATGACGCAGTTGGGCCGGACGTAGCTCAGGGCTCTGACTCTCCCGACGTTGAAGGGTTGAGATCATGAGCCCCAGAACATGGCGAAGTAGTGTATCGCAAGGCTGAGGGAACAGGTAAAACCTGCGAATGGCGATAATAGGGTAATGATCCAGTGGATGATCTACTTCCGAGTTTCTCCTGGTCTCGCGCCGCCGCATTACAGGATATTCAGCTACAGCTGCGACTCGTTTAGAATTGGTCGAGGGTATCTAGACCTTTTTCCACGCAAATCTAGTATCCGTAGTGCGTGGCCGAACATCTTCCCATTGCAGTATGCCGATAGGTATCCCGAGTTCCGTGTGTTCGAAATTAGTCGTCCACTATTCTCCCCTAGCGCCTGGGTGCGGGATTCCGCAGTTAGGAAGCTATTCCTGGGCCTAGAAGTAGCCATCCTCGGCGGCTAACGAGTGATGCTCAGGAGTGCGTTACGAGGCCACCTTACTTACGTGAAGGTAAGTTAATTACTATATCGGCCCTTGGCTGGCTTTATAGAGTATACTGATGAAACCTTCTAGAGATTAAACTCACAGTACAATCATTTGGGAGCGCACTTAGGATGACGATTCGATGACACGAAGTGTAGCGCTAGGACATCGTACAACTGTTTTCTTTCTGAAACAGATGTTAGTCAAACTGACATAAGCTAGTTTTCCCACAGAGTATGACCAGGAGACTAATCCTATATGATCATATTGCGGGCGTACCATCCCTGCGGTGGCATGCTTAATACACCCCTTGACATATGTCCCGCACTTTACATCATTATATCATAAATCCACAGTGGGTGGTCTTTCGCTATTAGCGATTTTCGATACTGGAAGACAGTCTCCTAGTATTCTGTGTAATGTAGAAGGGCCATCGTAAATAGAAGCCAGGCACCTCCCCAAGTACCTGGCGTAACATAAGTACTGGCAACACGGGGTATGGCTAGTCACAAAGGCGATGGCGCTCGTTAAGGAATGCTTATGCTAGCTGAGGAGAAATCGGTTCGTGCCTTGTTCGTGGTTAATCGCGCTTGATGCACGATAGCCAGTTCCCATTTCAATGCTGGAAGTTTTGCCTCTTGTAGATAAATTAGCTATCTCTTAACTTGCGATCTAGTCCAAGTCCCATCTGTGTCTATGGTTCAGCCTCCCCGCATGGGTATAGTTCCGCACTAACCTCGTACCACGGAGCGCCTGTGGCCGACTCGTCGCGGTCATAAATGGCACCATTAGGCTCTTTGCGGTGGTCAATCCTTAGTGGGAGCACTCGGACCAGAGCGCAGATCTCTTGATGGCTTGTGTGATTCCTGTAAGTTCTCTTCGCGGTGATCTACAAATACACAAACACACTCAAAGCAATTTCATGTTAGATCTAAACGTGAGCTAAAACGTGCGGTAACAGACCGCCACTCACGCGGTACACGATGCACTTACCACGAAGGGCGAGGCATAATGGTAAATCTGGCCTGAGTTTCGCTGTATTTTCCCATCTGTAAAGGGGATTCATTGACAGTCTTAATGGCCCCGCCGTAGGATGATGTAATGATCAGAACGACTAGGAGCGAAAATCGGGTAGTCAGAGAACTAATTCATATGCTCGGCGTCACTAAAGGTATCGCTTGAGCTAAGCACCTTCGAGCCTGCAAAAAACAAACTAAATTAGCGTTGTTATACCGAGCAGTCCGGCCCGACCTTATGATACTCCGGCCAACTGCGTAGTGGCATACCAGACCAGCTGTCTGTCGAATATAACCGTCTAACCAAGTTACAGCACAATTAAACTTATAGCTCAGACGGCTGAACACCCTTTAACCTAGGTGATCTGTCGCAAGCATGTACACAAAACGTCTTCAATTCCCCGGAGACATAAACTCGTTGGGGGATAACGTTTTTGCCAGATTTTACCGGTCTGTATATCAGCTCCCAACCGAGGCTATTCAAGATTTACTTATCTTGCCAGAAGATGGGTTGCACATTGTCACCGGTGGACTTTAAGCCAGCGGTACTATAACCAGCAGAAAAGATTCTACTCAGATGATCCCGGCGCTGGCATCACGTGAGTCACGATATGTTATTAAGAGAACAAGTCGGCGAGTGTGACACTAGAAGGTCTCTGGAAAGGCGAGCGAAGAGGGAGCTCCAACGGCATTAACAACTAGGGTTGCTGCATGGTTATCCAAGTTCCGCAGCCACCAGTAGACACTTCAGCTCAGGTCTGTTCGTGCCAAGCCCAGTAAGTGTGTGGGCTTGGTTAGAGTTCGCGACGTGGCTAATGTGACGTGTCTGCAGAGCCGGAAGACCGTATGCGTAGGATAGTCCAAGCCAGCGCGGACTATCAAACCATCATTTCCGAGTAGTTACCAGCTTATGTGCGAGAGGGTTATTTAGCTTAAGGCCTGGCTATTCATACCTACTATGGCTACCGTACAGTCGCAAATTGGTCCCGAGCAACAGCCGACCTATACCAAATGCTCAAACTACTTGCCTCTTAGTAGGAGATATCTTTCCTACTGCTATACTCGGTCGAGAGGAATTCGGTCTCTATGTTAGTTACCGCTGTTTATGCTAACTCTTTGCCCGTTTGTTGGTCTCG",
  "digests": {
    "algorithm": "sequon-digest/1",
    "sequence": "sha256:e9fd492df2c754c78553a079dd426a86362fc900bd17b7374291b921cff48edf",
    "canonical": "sha256:39ce3e1fe5ebff6481a06fa2adce9e9c85e7f56aec019d485f95aa6ad8c49a64"
  },
  "features": [
    {
      "key": "misc_feature",
      "so_term": "SO:0000110",
      "name": null,
      "location": {
        "operator": "span",
        "strand": 1,
        "segments": [
          {
            "start": 5899,
            "end": 6100,
            "start_partial": false,
            "end_partial": false
          }
        ]
      },
      "qualifiers": [
        {
          "key": "note",
          "value": "spans the origin"
        }
      ]
    }
  ],
  "provenance": {
    "producer": {
      "kind": "parser",
      "name": "sequon-io",
      "version": "0.1.0"
    },
    "source_format": "genbank",
    "source_digest": "sha256:4c5bd14c5e28364227009da3197984d4385c3bc3a50fc4cb12547b97838c2fc7",
    "source_bytes": 7843,
    "export_version": null
  },
  "extras": {
    "genbank": {
      "division": "SYN",
      "header": [
        {
          "key": "DEFINITION",
          "value": "cross origin feature."
        }
      ]
    }
  }
}
