{
  "schema": "sequon/record/1",
  "kind": "dna",
  "molecule_type": null,
  "topology": "circular",
  "name": "sequon-fixture-020",
  "description": null,
  "length": 153,
  "sequence": "ACGTACGTGGCCTTAAGGCCTTCGAAACGTACGTTAGCATCGATCGTACGATCGATCGTAGCTAGCTAGCATCGATCGTAGCTAGCTAGCATCGATCGTAGCTAGCTAGCGATCGATCGATCGTAGCTAGCTAGCATCGATCGTAGCTAGCTA",
  "digests": {
    "algorithm": "sequon-digest/1",
    "sequence": "sha256:a9d9ad4d2364e37ba5dd01f1871ed2a49f0f6a09d6853940a7ed3dfc637ab3bc",
    "canonical": "sha256:febecd5a83e9b504f4ba02c0acd82d364deb663e4af17d98022b804152bf1fd7"
  },
  "features": [
    {
      "key": "misc_feature",
      "so_term": "SO:0000110",
      "name": "join-order",
      "location": {
        "operator": "join",
        "strand": -1,
        "segments": [
          {
            "start": 19,
            "end": 30,
            "start_partial": false,
            "end_partial": false
          },
          {
            "start": 4,
            "end": 10,
            "start_partial": false,
            "end_partial": false
          }
        ]
      },
      "qualifiers": []
    }
  ],
  "provenance": {
    "producer": {
      "kind": "parser",
      "name": "sequon-io",
      "version": "0.1.0"
    },
    "source_format": "snapgene-dna",
    "source_digest": "sha256:3faf6994f543511b55c4dbaf64f1173a05c4707ef6200feb7e3172bd3facc305",
    "source_bytes": 712,
    "export_version": 15
  },
  "extras": {
    "snapgene": {
      "dna_flags": 1,
      "features": [
        {
          "attributes": [
            {
              "name": "recentID",
              "value": "0"
            }
          ],
          "feature_index": 0,
          "key": "misc_feature",
          "qualifiers": [],
          "segments": [
            {
              "attributes": [],
              "segment_index": 0
            },
            {
              "attributes": [],
              "segment_index": 1
            }
          ]
        }
      ],
      "notes": [
        {
          "attributes": [],
          "name": "UUID",
          "value": "00000000-0000-4000-8000-000000000001"
        },
        {
          "attributes": [],
          "name": "Type",
          "value": "Synthetic"
        },
        {
          "attributes": [],
          "name": "ConfirmedExperimentally",
          "value": "0"
        },
        {
          "attributes": [],
          "name": "CustomMapLabel",
          "value": "sequon-fixture-020"
        },
        {
          "attributes": [],
          "name": "UseCustomMapLabel",
          "value": "1"
        },
        {
          "attributes": [],
          "name": "Organism",
          "value": "synthetic construct"
        }
      ]
    }
  }
}
